{
  "schemaVersion": 1,
  "recordId": "windows-19977-full-semantic-v031",
  "platform": "windows",
  "wmpfVersion": 19977,
  "packageVersion": "0.3.1",
  "recordedAt": "2026-07-18T08:34:23.249Z",
  "validationDepth": "full-semantic",
  "recordStatus": "verified",
  "module": {
    "name": "flue.dll",
    "sha256": "f569e0ddcd622e85fb33a0e2a4c647561fd27440c9612a54140572a42c8cfc7d"
  },
  "profile": {
    "path": "data/profiles/clean-room/windows-19977.json",
    "fileSha256": "3d96aa425f88b26e56cb60721170d7287540948b547cad3e37160a140542a1d4",
    "provenance": "generated",
    "confidence": "high"
  },
  "gates": {
    "profileSchema": {
      "status": "passed",
      "evidence": [
        "profile"
      ]
    },
    "moduleHash": {
      "status": "passed",
      "evidence": [
        "profile",
        "live-summary"
      ]
    },
    "aobUnique": {
      "status": "passed",
      "evidence": [
        "signature-db",
        "profile"
      ]
    },
    "hookAttach": {
      "status": "passed",
      "evidence": [
        "live-summary"
      ]
    },
    "runtimeBridge": {
      "status": "passed",
      "evidence": [
        "live-summary"
      ]
    },
    "appserviceContext": {
      "status": "passed",
      "evidence": [
        "live-summary"
      ]
    },
    "evaluate": {
      "status": "passed",
      "evidence": [
        "live-summary"
      ]
    },
    "breakpoint": {
      "status": "passed",
      "evidence": [
        "live-summary"
      ]
    },
    "trace": {
      "status": "passed",
      "evidence": [
        "live-summary"
      ]
    },
    "requestHook": {
      "status": "passed",
      "evidence": [
        "live-summary"
      ]
    },
    "networkBody": {
      "status": "passed",
      "evidence": [
        "live-summary"
      ]
    },
    "replay": {
      "status": "passed",
      "evidence": [
        "live-summary"
      ]
    },
    "reconnect": {
      "status": "passed",
      "evidence": [
        "live-summary"
      ]
    },
    "evidenceExport": {
      "status": "passed",
      "evidence": [
        "live-summary",
        "progress"
      ]
    },
    "detach": {
      "status": "passed",
      "evidence": [
        "live-summary"
      ]
    }
  },
  "evidenceRefs": [
    {
      "id": "profile",
      "kind": "repository",
      "ref": "data/profiles/clean-room/windows-19977.json"
    },
    {
      "id": "signature-db",
      "kind": "repository",
      "ref": "data/profiles/aob-signatures.json"
    },
    {
      "id": "live-summary",
      "kind": "workspace",
      "ref": "workspace/live-verification/wechat-miniapp/live-semantic-gate-v0.3.1-wmpf19977-1784363599773.json",
      "sha256": "efa04133c5352eb83b28fe8bc1b24807ecee1f610d31c91f1d39c677ed8168d1",
      "note": "Local sanitized summary; target artifacts remain outside Git."
    },
    {
      "id": "progress",
      "kind": "repository",
      "ref": "docs/progress.md#v031-live-runtime-closure"
    },
    {
      "id": "delivery-pr",
      "kind": "github",
      "ref": "https://github.com/Facetomyself/wechat-miniapp-re-mcp/pull/7"
    },
    {
      "id": "review-p0-pr",
      "kind": "github",
      "ref": "https://github.com/Facetomyself/wechat-miniapp-re-mcp/pull/15"
    }
  ],
  "notes": [
    "The full gate covered AppService selection, evaluate, a bound breakpoint, trace wrappers, request hooks, API inventory, Network response body, replay, same-session reconnect, evidence export, and detach.",
    "The post-review repeat after PR #15 passed every required live gate with an empty runner error list; lifecycle findings were resolved before export."
  ]
}
